Title,Clean_JobDescripton
Project Manager,The UNDP and the Ministry of Health seekprofessionals for the project HIVAIDS and Uniformed Services
Project Manager,The Foundation Internews Georgia is seeking aqualified candidate for the full time position of Project Manager
Project Manager,Project Manager is mainly a project managementadministration position The person follows up progress of the teamsin various projects and does planning together with the architect Thisrole requires problemsolving attitude
Project Manager,International Society for Fair Elections and DemocracyISFED announces vacancy for the fulltime position of Project Manager
Java Developer,Creating and developing software products for Network
Java Developer,A leading American software development company isactively looking for Java developers for complex and longterm projectsThe position entails working with Sun and IBM products portal solutionsthe latest Java technologies and Documentum products  the world leaderin EDMS solutions The projects will deal with large wellknowncustomers
Project Manager,To achieve the objectives of the British Councils SEEurope Regional Plan and Armenia Country Plan through the planningimplementation and evaluation of projects mainly but not exclusivelyin Education  and Governance
Sales Manager,On behalf of its partner Ameria CJSC is seekingapplicants for the position of Sales Manager Sales Manager manages thecompanys sales and development functions provides highly responsibleand technically complex staff assistance to CEO The work performedrequires a high level of proficiency in marketing distribution andsales management as well as management supervisory and administrativeskills
Java Developer,A leading American software development company isactively looking for Java developers for complex and longterm projectsThe position entails working with Sun and IBM products portal solutionsthe latest Java technologies and Documentum products  the world leaderin EDMS solutions The projects will deal with large wellknowncustomers
Java Developer,A leading American software development company isactively looking for Java developers for complex and longterm projectsThe position entails working with Sun and IBM products portal solutionsthe latest Java technologies and Documentum products  the world leaderin EDMS solutions The projects will deal with large wellknowncustomers
Project Manager,The Project Manager will work for ArmeniaImprovingthe Energy Efficiency of Municiple Heating and Hot Water SupplyProjectUnder direct supervision of the National Project Coordinator theincumbent will ensure daily management of project ongoing activities
Project Manager,The Armenian branch of a USbased software company isseeking to fill the position of a Project Manager The responsibilitiesof this position are focused on assistance to the Senior Project Managerand Regional Representative in carrying out the monitoring and evaluationthe project implementation procedures
Sales Manager,We are looking for a dedicated responsible activeand enthusiastic personality for the position of Sales Manager
Project Manager,Synergy International Systems Inc is seeking to fillthe position of a Project Manager The responsibilities of this positionare focused on assistance to the Senior Project Manager and RegionalRepresentative in carrying out the monitoring and evaluation the projectimplementation procedures This position will be filled by an individualwith a proven history of project management This position will befilled by a candidate who has experience in all aspects of the softwaredevelopment process including design development implementation andtechnical support
Sales Manager,We are seeking a Sales Manager for a company involvedin sale of building material
Project Manager,The Armenian branch of a USbased software company isseeking to fill the position of a Project Manager The responsibilitiesof this position are focused on assistance to the Senior Project Managerand Regional Representative in carrying out the monitoring and evaluationthe project implementation procedures The selected candidate willsupervise personnel involved in the project development as well asmonitor the actual project design This will include ensuring theapplication development testing and review processes and that servicerequirements goals are met The Project Manager will schedule conductand document project review meetings meet established deadlines travelabroad to conduct needs assessments provide consulting services tocompanys clients organize training sessions for users of Synergys WebDatabase technology projects etc This position will be filled by anindividual with a proven history of project management Experience in adynamic workplace with solid project management practice is required Ideally this position will be filled by a candidate who has experiencein all aspects of the software development process including designdevelopment implementation and technical support
Java Developer,The responsibilities of this position are focused oncore software development tasks in Synergy International Systems IncThis position will be filled by a software developer with a provenhistory of producing quality software product in a commercial settingwith experience in all aspects of the software development processincluding design implementation testing and delivery
Sales Manager,The Sales Manager will deal with trade representativesand partners
Sales Manager,The incumbent will sell real estate in the territoryof Vahakni Community
Java Developer,We are looking for a Java Developer with strongknowledge of relationship database
Project Manager,Promo International is looking for highly qualifiedcandidates to fulfill the position of Project Manager
Java Developer,The responsibilities of this position are focused oncore software development tasks in Synergy International Systems IncThis position will be filled by a Software Developer with a provenhistory of producing quality software product in a commercial settingwith experience in all aspects of the software development processincluding design implementation testing and delivery
Sales Manager,Business Depot International Services LLC is lookingfor candidates to fulfill the position of Sales Manager
Java Developer,The responsibilities of this position are focused oncore software development tasks in Synergy International Systems IncSynergys main focus is on developing integrated stateoftheart WebDatabase and Web Portal systems for business intelligence knowledgemanagement and eGovernment solutions This position will be filled by asoftware developer with a proven history of producing quality softwareproduct in a commercial setting with experience in all aspects of thesoftware development process including design implementation testingand delivery
Java Developer,An American software development company is activelylooking for Java developers for complex and longterm projects Theposition entails working with Sun and IBM products portal solutionsthe latest Java technologies and Documentum products  the world leaderin EDMS solutions The projects will deal with large wellknowncustomers
Sales Manager,We are looking for a candidate to fulfill the positionof Sales Manager who will communicate with clients and organize wholesale process in the company office
Java Developer,Vested Development Inc is actively looking for Javadevelopers for complex and longterm projects The position entailsworking with Sun and IBM products portal solutions the latest Javatechnologies The projects will deal with large wellknown customers
Sales Manager,The incumbent will sell real estate in the territoryof Vahakni Community
Java Developer,Synergy International Systems IncArmenia seeks tofill the position of Java Developer The responsibilities of thisposition are focused on core software development tasks in SynergyInternational Systems Inc
Project Manager,ArmenTel is looking for candidates to fulfill theposition of Project Manager
Project Manager,The Armenian branch of a USbased software company isseeking candidates with a proven history of project management to fillthe position of a Project Manager The responsibilities of this positionare focused on assistance to the Senior Project Manager and RegionalRepresentative in carrying out the monitoring and evaluation the projectimplementation procedures The selected candidate will supervisepersonnel involved in the project development as well as monitor theactual project design
Project Manager,Cornerstone is looking for candidates to fill theposition of Project Manager
Java Developer,The responsibilities of this position are focused onsoftware development tasks related to the upcoming projects in SynergyInternational Systems Inc This position will be filled by a softwaredeveloper with a proven history of producing quality software product ina commercial setting with experience in all aspects of the softwaredevelopment process including design implementation testing anddelivery
Java Developer,EPAM Systems is actively looking for Java developersfor complex and longterm projects The position entails working withSun and IBM products portal solutions the latest Java technologies
Project Manager,The primary objective of this position is to ensurethe highest possible efficiency level from the project team to thesuccessful completion of projects while maintaining compliance toprocess  The incumbent will act a liaison between business and theproject team and instill a passion for excellence on the team
Java Developer,Nairisoft Inc is looking for a highly qualifiedperson with deep knowledge and practical experience in Web programmingThe selected candidate will be involved in all stages of the developmentlife cycle
Sales Manager,Valletta LLC is announcing a position of Sales Managerand looking for a highly motivated and experienced person
Sales Manager,Yerevan Telecom Solutions seeks highly motivated andexperienced candidates to fill the longterm position of Sales Manager
Sales Manager,Kantis management is looking for Sales Manager whowill work with foreign organizations in the field of telecomunication
Sales Manager,Almeda CJSC is seeking a qualified person for theposition of Sales Manager to be responsible for sale of medicalproducts
Java Developer,SCDM LLC is looking for highly experienced Javadevelopers for a longterm project They will work as a member of a teambased on the guidelines and technical assistance of Austrian partners fordeveloping special software in financial analysis field The incumbentwill work in close collaboration with the Project Manager to understandthe application requirements and be able to validate that thedevelopment answers the business requirements
Java Developer,Lucipa Software is developing a new product and islooking for Java Developers to lead the application design efforts Thisincludes production of written design specifications and the definitionof development activities required to meet the business requirementsThe Java Developers are responsible for handson software developmentand ensuring the highest quality of all delivered solutions throughunit integrated and full system testing activities Efforts insoftware development will run from analysis through implementation
Java Developer,EPAM Systems is actively looking for Java developersfor complex and longterm projects The position entails working withSun and IBM products portal solutions the latest Java technologies
Java Developer,The Virtual Solution Global Services LLC is seekingfor a motivated Java Developer for Web based applications development
Java Developer,Webb Fontaine Armenia is seeking for Java Developerfor the development of Javabased applications on proprietary platform
Java Developer,IOGenic is seeking a Java Developer who will workunder the direct supervision of IOGenics General Management
Java Developer,EPAM Systems is actively looking for Java developersfor complex and longterm projects The position entails working withSun and IBM products portal solutions the latest Java technologies
Java Developer,Damaris AM Ltd is looking for a qualified JavaDeveloper to participate in Damaris products development
Sales Manager,New Age Travel LLC is looking for hard workinghighly motivated individuals who will skillfully represent the companyto the customers
Sales Manager,Raffael Contini one of the coffee manufacturers inArmenia is seeking a Sales Manager to be responsible for domestic salesof the companys produce
Java Developer,The Virtual Solution Global Services LLC is seekingfor a motivated Java Developer for Web based applications development
Java Developer,NairiSoft Inc is looking for a highly qualifiedperson with deep knowledge and practical experience in Java programmingThe selected candidate will be involved in all stages of the developmentlife cycle
Project Manager,The Virtual Solution Global Services LLC is seeking aProject Manager to manage Web based application projects
Java Developer,The Virtual Solution Global Services LLC is seeking amotivated Java Developer for Web based applications development
Java Developer,Boomerang Software LLC is looking for Java Developersto be engaged in different long term projects
Sales Manager,NatFood CJSC is announcing a position of Sales Managerand looking for a highly motivated and experienced professional
Project Manager,Damaris LLC is seeking a Project Manager to managecompanys projects
Java Developer,Energize Global Services CJSC is looking for JavaDevelopers to be engaged in different long term projects
Java Developer,EPAM Systems is actively looking for Java developersfor complex and longterm projects The position entails working withSun and IBM products portal solutions the latest Java technologies
Sales Manager,Ivtrans LLC is looking for a Sales Manager toundertake the daytoday operation management of sales
Java Developer,The Virtual Solution Global Services LLC is seeking amotivated Java Developer for Web based applications development
Sales Manager,Prof Al LLC is looking for a qualified person tomanage all the activities of a new opening showroom in Yerevan todevelop implement and manage the companys marketing and salesstrategy
Java Developer,EPAM Systems is actively looking for Java developersfor complex and longterm projects The position entails working withSun and IBM products portal solutions the latest Java technologies
Sales Manager,The Sales Manager works towards development of salesof ArArAt and PR imported products
Project Manager,The responsibilities of the position of a ProjectManager are focused on assistance to the Regional Representative incarrying out the monitoring and evaluation of the project implementationprocedures The PM establishes project plans schedules and assignsresources accordingly supervises personnel involved in the projectdevelopment as well as monitors the actual project design This includesensuring the application development testing and review processes andthat service requirements goals are met The Project Manager schedulesconducts and documents project review meetings meets establisheddeadlines travels abroad to conduct needs assessments providesconsulting services to companys clients organizes training sessionsfor users of Synergys IDM technology projects etc organizestrainings for internal teams as well as for the interns of theorganization
Sales Manager,ZangTelecom LLC Radionet is seeking for qualifiedSales Managers to be responsible for presentation and sales of theservices
Java Developer,Energize Global Services CJSC is looking for JavaDevelopers to be engaged in different long term projects
Java Developer,Essence Development LLC is seeking a highly motivatedJava Developer to develop and build high quality web applications Inthis role the developer will not only help building next generation webapplications but will also enhance and maintain existing JavaJ2EEapplications The developer will be working on a range of challengingprojects throughout the full development life cycle
Java Developer,EPAM Systems is actively looking for Java developersfor complex and longterm projects The position entails working withSun and IBM products portal solutions the latest Java technologies
Sales Manager,Megamotors LLC is seeking a candidate for the positionof sales manager who will assume responsibility for showroom visitors andcustomers demonstrating excellent product knowledge appraisingdisplaying and merchandising the Mitsubishi vehicles
Project Manager,CHAP Project Manager is responsible for managing allaspects of the project planning and implementation including projectjustification and conceptualization humanitarian assistancedistribution monitoring and providing feedback information Under thedirection of HQ and the Country Director the incumbent in this positionwill also serve as the liaison and main contact person for thedevelopment of new business initiatives in support of growing revenuesfrom nonDOS funded sources This will involve up to 20 of hishertime The range of activities include but is not limited to identify newclients and partner organizations as well as recipients and their needswithin the project framework input information related to the projectinto CHAP MS Access Database CHAPBASE reports to the CHAPArmeniaCountry Program Director
Sales Manager,Master Class Tennis  Fitness Club is looking for amotivated and proactive candidate for the position of Sales Manager forits new opening fitness center
Java Developer,EPAM Systems is actively looking for Java developersfor complex and longterm projects The position entails working withSun and IBM products portal solutions the latest Java technologies
Java Developer,NairiSoft Inc is looking for a highly qualifiedperson with deep knowledge and practical experience in Java programmingThe selected candidate will be involved in all stages of the developmentlife cycle
Project Manager,EPAM Systems is actively looking for Project Managerfor complex and longterm software development projects The projectswill deal with large and wellknown customers both in Europe and theUnited States
Sales Manager,Master Class Tennis  Fitness Club is looking for amotivated and proactive candidate for the position of Sales Manager
Sales Manager,ZangTelecom LLC RadioNet is seeking qualified SalesManagers to be responsible for presentation and sales of the services
Project Manager,The Project Manager will be responsible for the timelyand cost compliant delivery of a complex and extensive communicationsnetwork Heshe will have comprehensive authority to enable theaggressive management of this endeavor The position requires amotivated self starter with exceptional organizational skillssignificant PM and problem resolution experience
Java Developer,EPAM Systems is actively looking for Java developersfor complex and longterm projects The position entails working withSun and IBM products portal solutions and the latest Java technologies
Sales Manager,The Sales Manager will be responsible for promotingInsurance products in the market
Sales Manager,The Sales Manager will build lead and develop ahighly motivated achievementoriented sales team and support indirectchannels capable of meeting or exceed demanding sales targets and profitmargin objectives
Java Developer,Boomerang Software LLC is looking for a Java Developerto be engaged in different long term projects
Sales Manager,CornetAm CJSC is looking for a motivated andwellorganized candidate for the position of Sales Manager for thecompanys sales office
Project Manager,The objective is to provide technical support to theProject Manager for implementation of pension reform  This projectincludes activities performed by several parts of the Government ofArmenia as well through a large systems development contract  Theproject manager is responsible for maintaining contact with all aspectsof implementation and in particular tracking meeting of benchmarks in atimely fashion   This position will provide technical support indeveloping and maintaining a Microsoft Project plan to facilitate theseactivities
Java Developer,Energize Global Services CJSC is looking for JavaDevelopers to be engaged in different long term projects
Sales Manager,Boomerang Software LLC is looking for committedindividuals to fill the position of Sales Manager The successfulcandidates will be expected to take responsibility for identifying newopportunities following up enquiries and converting proposals quotations into firm orders
Project Manager,Energize Global Services CJSC is looking for a ProjectManager to be engaged in different long term projects
Sales Manager,Asya Baghdasaryan PE is looking for dynamicpersons with strong communication presentation and negotiation skillsto work under the supervision of the Marketing Director
Sales Manager,Sales Manager is responsible for full aspects ofestablishment of cooperation with customers sales of products anddevelopment of relationships with potential and current customersHeshe is also responsible for presales and postsales relatedadministrative tasks
Sales Manager,Sales Manager is responsible for full aspects ofestablishment of cooperation with customers sales of products anddevelopment of relationships with potential and current customersHeshe is also responsible for presales and postsales relatedadministrative tasks
Java Developer,NairiSoft Inc Armenia is looking for a highlyqualified person with deep knowledge and practical experience in Javaprogramming The selected candidate will be involved in all stages ofthe development life cycle
Project Manager,The National Competitiveness Foundation of ArmeniaNCFA is seeking to hire a Program Project Manager to oversee andmanage the design and implementation of sectorspecific projects intourism healthcare and education as well as crosscutting projects ininfrastructure and capacity developmentThe ProgramProject Manager will be responsible for managing the designand implementation of the NCFA projects Depending on the level ofqualifications and the nature of the projects the candidate will reporteither to the directors of NCFAs sector teams such as the Director ofthe Tourism Office or directly to the Chief Executive Officer of theNCFA
Sales Manager,IUnetworks LLC is looking for a motivated individualto fill the position of Sales Manager The position  holder will assistclients in hardware and software tools selection create quotes for SUNPlanet and Erickson products followup purchase orders etc
Sales Manager,Kinetik CJSC Orange Fitness is looking for amotivated and proactive candidate for the position of Sales Manager
Project Manager,Redinet CJSC is looking for highly responsibleindividual to be directly involved in management of telecommunicationsphere related project processes and activities and be responsible forlarge scale projects or a significant segment of large and complexprojects
Project Manager,The Project Manager will be responsible for the timelyand cost compliant delivery of a complex and extensive communicationsnetwork Heshe will have comprehensive authority to enable theaggressive management of this endeavor The position requires amotivated self starter with exceptional organizational skillssignificant PM and problem resolution experience
Sales Manager,Natfood CJSC is announcing a position of SalesManager and is looking for a highly motivated and experiencedprofessional Sales Manager should develop implement and manage thecompanys sales strategy to ensure efforts to meet goals and objectiveswith direct reporting to the Chief Executive Officer
Sales Manager,Unitel LLC is seeking a highly motivated andprofessional Sales Manager
Sales Manager,Muran LLC is looking for a candidate to fulfill theposition of Sales Manager to sell vehicles and sign contracts with thecustomers
Project Manager,The role of the Project Manager is to plan executeand finalize projects according to strict deadlines and within budgetThis includes acquiring resources and coordinating the efforts of teammembers and thirdparty contractors or consultants in order to deliverprojects according to plan The Project Manager will also define theprojects objectives and oversee quality control throughout its lifecycle
Sales Manager,Cascade Telecom LLC is seeking motivated andcommercially orientated Sales Manager to work with companys corporatecustomers and partners
Project Manager,Under the overall authority of the Directorate Generalof Human Rights and Legal Affairs DGHL of the Council of Europe CoEand the Head of the Legal and Human Rights Capacity Building Divisionand daily supervision of the Head of the Council of Europe Office SRSGin Yerevan the Project Manager will be responsible for theimplementation of the Support for Access to Justice in Armenia Projectin Armenia
Project Manager,The Project Manager will be responsible for the timelyand cost compliant delivery of a complex and extensive communicationsnetwork She will have comprehensive authority to enable the aggressivemanagement of this endeavor The position requires a motivated selfstarter with exceptional organizational skills significant PM andproblem resolution experienceThe incumbent will be responsible for authorization and processingcreation and maintenance of all project critical documentationcorrespondence and reports and chairing of regularly scheduled projectmeetings
Sales Manager,Magic Sale LLC is seeking motivated and commerciallyoriented Sales Manager to attract new clients and organize current workwith the existing ones
Sales Manager,Ar  Ar Design Construction is looking for highlymotivated candidates for the position of Sales Manager for one ofcompanys 22C stores
