Title,Clean_JobDescripton
Project Manager,World Vision Armenia is looking for a Project Managerwho will be responsible for overall management of the ECfunded projectReducing Violence against Children in Armenia The incumbent willprovide day to day management to achieve high quality results in linewith acceptable project norms which are relevant to the establishedgoals objectives and operating policies of the project and WV ArmeniaIn accordance with EC grant regulations the Project Manager willsupervise the financial management of the grant in relation to projectgoals and objectives yearly activity schedule timing of expendituresbudgets etc
Project Manager,Altacode LLC is looking for an experienced ProjectManager
Project Manager,Altacode LLC is looking for an experienced ProjectManager
Java Developer,AtTask Inc is looking for Java Developers withexperience in Perl to develop internal applications that support dailybusiness operations at Yerevan office
Sales Manager,Magic Sale LLC is seeking motivated and commerciallyorientated Sales Manager to attract new clients and organize currentwork with the existing ones
Project Manager,Project Management Unit PMU CJSC is looking for ahighly qualified Project Manager Under the supervision of ProjectManagement Unit Director the incumbent will create and execute projectwork plans and revise as appropriate to meet changing needs andrequirements
Sales Manager,Nushikyan Association LLC is seeking motivated andcommercially oriented Sales Manager to attract new clients and organizecurrent work with the existing ones
Project Manager,The role of the Project Manager is to plan executeand finalize projects according to strict deadlines and within budgetThis includes acquiring resources and coordinating the efforts ofstakeholders team members and thirdparty contractors or consultants inorder to deliver projects according to plan The Project Manager willalso define the projects objectives and oversee quality controlthroughout its life cycle
Sales Manager,Victoria Pasta is looking for a motivated andcommercially oriented Sales Manager to attract new clients and organizecurrent work with the existing ones
Project Manager,World Vision Armenia is seeking a Project Manager forWorld Visions proposal on Child Protection Systems Strengthening inArmenia World Vision is submitting a proposal to USAID for theDisplaced Children and Orphans Fund DCOF and anticipates decisionregarding funding in July 2010The Project Manager will have overall responsibility for the managementof all project activities and staff She will have principalresponsibility for representation of the project to the Donor The PMwill serve as representative of the project and will be responsible forthe activities and all longterm and shortterm personnel under thisgrant The PM shall have a keen understanding of the unique politicaldynamics and will work carefully and collaboratively to support thevarious political entities The PM should embrace the shared USGovernment vision for the project and effectively manage availablefinancial and Human Resources to make that vision a reality The PM ischarged with leading a professional team in the accomplishment of theobjectives of the project proposal She must have a broad vision linkedwith a clear understanding of how to get things done amid the constraintsof the country contextShe will have direct supervision over project key personnel the DeputyProject Director the Finance Director etc The Project Director isresponsible for all technical and administrative aspects of the projectincluding financial management
Sales Manager,Redinet CJSC is seeking qualified Sales Manager to beresponsible for presentation and sales of telecommunication relatedproducts and services
Sales Manager,Muran LLC is looking for a candidate to fulfill theposition of Sales Manager to sell vehicles and sign contracts with thecustomers
Project Manager,SAS Group is seeking a Project Manager to beresponsible for planning execution and finalization of projectsaccording to strict deadlines and within budget The role will be aswell responsible for defining the projects objectives and providingdaytoday coordination to ensure quality control throughout theprojects life cycle
Project Manager,The role of the Project Manager is to plan executeand finalize projects according to strict deadlines and within budgetThis includes acquiring resources and coordinating the efforts of teammembers and thirdparty contractors or consultants in order to deliverprojects according to plan The Project Manager will also define theprojects objectives and oversee quality control throughout its lifecycle
Project Manager,Internews Media Support NGO seeks qualified candidatesfor the USAIDfunded Alternative Resources in Media Development ARMediaproject Under the overall supervision of the Project Internews ManagingDirector the incumbent will plan execute and finalize projects accordingto strict deadlines and within budget She will be responsible for thedaytoday management and coordination of the project componentsincluding acquisition of resources and coordination of efforts ofpartners team members thirdparty contractors or consultants in orderto deliver projects according to plan
Project Manager,The role of the Project Manager is to plan execute andfinalize projects according to strict deadlines and within budget Thisincludes acquiring resources and coordinating the efforts of team membersand thirdparty contractors or consultants in order to deliver projectsaccording to plan The Project Manager will also define the projectsobjectives and oversee quality control throughout its life cycle
Sales Manager,Redinet CJSC is seeking a qualified Sales Manager to beresponsible for presentation and sales of Telecommunication relatedproducts and services
Sales Manager,This role requires introducing products and services todifferent companies The incumbent will also be responsible for workingout strategies to increase sales
Sales Manager,ZX Garage LLC is seeking a qualified Sales Managerresponsible for sales of tires rims oils filters and spare parts
Sales Manager,Catherine Group Ltd is inviting highly qualifiedprofessionals to fulfill the position of a Sales Manager The incumbentwill be responsible for the promotion of baby food products
Sales Manager,The incumbent will be responsible for implementing thecurrent sales stock activities
Java Developer,TX Systems is seeking an experienced Java Developer fordevelopment of Web based applications
Sales Manager,Galoper LLC is looking for a candidate to fulfill theposition of Sales Manager to sell vehicles and sign contracts with thecustomers
Sales Manager,Natfood CJSC is looking for a highly motivated andexperienced professional to work as a Sales Manager The incumbent shouldimplement and manage the companys sales strategy to ensure efforts tomeet ambitious goals and objectives
Sales Manager,The Sales Manager will lead the sales team with dozenaccounts that include retailers restaurants hotels and other food andbeverage outlets across Armenia
Sales Manager,Magic Sale LLC is seeking motivated and commerciallyoriented Sales Manager to attract new clients and organize current workwith the existing ones
Sales Manager,Catherine Group Co Ltd is looking for a candidateto fulfill the position of a Sales Manager to sell vehicles and signcontracts with the customers
Project Manager,Virtual Solution Global Services LLC is seeking for aSoftware Project Manager
Java Developer,IUnetworks is looking for a motivated Java Developerfor Web based enterprise level applications development
Sales Manager,Biska Group LLC is looking for energetic andexperienced individuals for the position of Sales Manager Heshe willwork under the supervision of the Founding Director
Sales Manager,The incumbent will be responsible for sales ofcompanys products  tiles of natural stones
Sales Manager,The incumbent will be responsible for the sales ofcompanys products  food products
Project Manager,The Project Manager will create and execute projectwork plans and revise as appropriate to meet changing needs andrequirements She will have overall responsibility for the management ofall project activities and staff She will have principal responsibilityfor representation of the project to partner institutions
Sales Manager,Redinet CJSC is seeking a qualified Sales Manager to beresponsible for presentation and sales of telecommunication relatedproducts and services
Project Manager,The National Competitiveness Foundation of Armenia isseeking to hire a Project Manager to lead the implementation of theFoundations Southern Corridor Tourism Framework project The ProjectManager will lead and oversee project implementation and will interfacewith the RA government private sector representatives donororganizations and institutional partners of the CompetitivenessFoundation The incumbent will report to the Tourism Program Director
Java Developer,AtTask has an opening for J2EE programmers withextensive UI experience in Web 20 development to assist in thedevelopment of its awardwinning project management application atYerevan office
Sales Manager,The incumbent will be responsible for sales ofcompanys products  tiles of natural stones
Sales Manager,Tempo Libero Ltd is seeking a qualified Sales Managerto be responsible for presentation and sales of entertainment fieldrelated products and services
Java Developer,The State Migration Service SMS of the Ministry ofTerritorial Administration of the Republic of Armenia is looking for aResearch Officer who will perform duties under the direct supervision ofthe Head of the Asylum Unit at the State Migration Service
Project Manager,Les Laboratoires Servier is looking for anenthusiastic selfmotivated personality who will combine excellentinterpersonal and organizational skills and have the ability to adapt toan international environment
Project Manager,The Armenian Branch of the Armenian MissionaryAssociation of America AMAA is searching for an Assistant Accountant
Sales Manager,Virtual Solution Global Services LLC is seeking amotivated Senior Java Developer for Web based applications development
Java Developer,Assistant Lawyer will be responsible for assistance tothe Chief lawyer for provision of legal services and human rightsprotection of most at risk population injection drug users sex workersmen having sex with men and people living with HIV
Project Manager,SAS Group is seeking a Graphic Designer to designmaterials including newsletters invitations advertisements flyersvouchers direct mail postcards and coupons
Sales Manager,Natali Pharm Ltd is seeking candidates for theposition of Medical Representative The incumbent is supposed to handlethe overall promotion works among doctors and pharmacists thoroughlyrepresenting company products
Project Manager,Internews Media Support NGO invites applications fromhighly qualified energetic and experienced Armenian professionals forthe position of Media Museum Manager for the Mobile Media Exhibition thatwill be organized within the framework of the Alternative Resources inMedia ARM Program Under the guidance of the Internews ARM ProjectDirector the incumbent will be directly working on organizing a portableexhibit focused on the media related evolution in Armenia
Project Manager,The incumbent will be responsible for organizingbookkeeping and accounting of economic and financial activities andcontrol of costeffective use of material labor and financial resourcessafe keeping of the companys property He she will also be responsiblefor taking part in resolving problem situations should it be beyond hisher competence to submit a number of resolution to the management
Sales Manager,The incumbent will research and develop softwaresystems according to clients requirements and continue debuggingenhancing and maintaining developed systems Primary responsibilitiesinclude data analyzing skills in combination with developing anddebugging database driven web based enterprise level software using Cprogramming language and SQL
Project Manager,Under the direct supervision of Deputy DirectorProject Manager the incumbent will be responsible for assisting theProject Coordinator and the Project Manager in the implementation ofAnimal Health Management in CrossBorder Areas of Armenia and GeorgiaProject
Java Developer,The incumbent will build trustful relations withcustomers by providing them assistance and support meet or exceedassigned sales targets by appropriately representing companys services
Sales Manager,Working in the Investment Banking division theincumbent will help clients solve some of their most critical financialand strategic challenges Ameriabank CJSC is looking for candidates whowill thrive in an environment where multitasking time management andstamina are essential He she should be comfortable working with numbersand be an analytical thinker
Sales Manager,The incumbent will be developing software applicationsand will be working in distributed team
Sales Manager,AN Audit CJSC is looking for successful candidates tofill the position of Chief Accountant  The Chief Accountant will beresponsible for conducting day to day bookkeeping for accounting andpreparation of financial statements tax returns and prudential reports
Sales Manager,AtTask has an opening for iPhone Application Developerwho will help to develop mobile applications for work management platformat Yerevan office
Sales Manager,Ameria CJSC is looking for motivated selfdriven youngprofessionals to join Ameria MAS Management Advisory Team The role ofthe Senior Consultant offers great opportunities to gain exposure toconsulting analysis and researching
Sales Manager,Monitis GFI CJSC is seeking an experienced Java WebDeveloper
Project Manager,The incumbent will be responsible for issuance andservice of plastic cards
Sales Manager,LeaderF Dental Clinics PE is seeking a Dentist whowill be able to perform all facets of dentistry
Sales Manager,Digital Chocolate Inc is looking for a smartIntegration Engineer The incumbent will be responsible to designdevelop and maintain high quality high volume and extensible gamingplatform
Sales Manager,The OSCE Office in Yerevan invites applications fromhighly qualified energetic and experienced Armenian professionals forthe post of Election Coordination Consultant to assist in coordinatingthe domestic observation efforts with the aim of strengthening the roleand participation of civil society organizations and the public in theelection process under the Special Service Agreement
Sales Manager,The incumbent will prepare contracts with physicalpersons and legal entities insuring minimization of risks of theorganization including development and maintenance of administrationsystems
Project Manager,He she will be responsible for testing differentproducts to assure service quality  The incumbent will organize andfollow up customer feedback collection and create and conduct surveys toidentify customers needs and satisfaction
Sales Manager,Debenhams is seeking a Chief Accountant to establishand monitor the implementation and maintenance of accounting controlprocedures to apply accounting principles and procedures to analyzefinancial information prepare accurate and timely financial reports andstatements and ensure appropriate accounting control procedures
Java Developer,Rosgosstrakh Armenia ICJSC is looking for a SystemAdministrator to perform responsibilities listed below
Sales Manager,The highly qualified Senior Software Developer willpower up the software project development team in a leading financialcompany The candidate for this position must have experience in objectoriented programming and developing client server applications
Sales Manager,EuFoA is seeking to enhance its team and particularlyits Yerevan Branch with a Project Coordinator
Sales Manager,The incumbent will supervise the Project Officer andthe Project Assistant He she will work under the direct supervision ofthe Secretary General and the guidance of the President
Sales Manager,Company is looking for a positive and active personwho will provide departments with necessary information cooperate withthem communicate with clients and help them find all they need aboutcompanys products and services
Project Manager,Company is looking for a person who is passionate aboutdatabase development and is willing to go above and beyond in a fastpaced environment The position involves the creation and maintenance ofSybase ASE 15 and Microsoft SQL 2005 2008 databases in developmentenvironment The candidate must be able to analyze requirements createinterpret data models  both logical and physical as well as code andtune SQL stored procedures
Sales Manager,The incumbent will be responsible for introducingcompanys services to customers
Project Manager,Studio One is looking for a PHP Developer to work oncomplex and longterm projects
Project Manager,Train and supervise the team of phlebotomists inpreparation for and during clinical studies conducted by DarmanTestLaboratories
Sales Manager,Sourcio is seeking experienced JavaScriptHTML5Developers particularly senior level for the development of featuresfor its partners awardwinning product
Project Manager,Sponsorship Coordinator will facilitate child sponsorrelations in Amasia Area Development Program ADP and ensure their fullcompliance with World Vision International WVI standards and policiesWorld Vision WV Armenias Sponsorship procedures and objectives
Java Developer,The incumbent will design and develop Eclipse Javabased Graphical User Interface GUI software
Sales Manager,The Social Media Specialist will be in charge ofwwwParliamentMonitoringam website promotion dissemination of currentand summary materials of the monitoring in social networks and mass mediaand stimulation of discussion on all possible platforms
Sales Manager,The primary objective of this position is thedevelopment and maintenance of wide range of automated tests such asfunctional regression stress load performance etc to test andensure the quality of Pegasus Logic products
Sales Manager,AtTask is looking for a Software Development Manager tohelp it take its technology processes and organization to the nextlevel The primary focus of this role is to drive the creation ofworldclass software through a combination of technical expertisethought leadership and direct management of several engineers TheSoftware Development Manager will help the team develop their skills andbecome more innovative productive and successful at their craft Theincumbent will also contribute to development of the AtTask application2030 of the time
Sales Manager,SAS Group is seeking a Fashion Product Developer forfashion trends research analysis and developing and sourcing fashionproducts
Sales Manager,Polpharma is looking for an enthusiasticselfmotivated personality who will combine excellent interpersonal andorganizational skills and have the ability to adapt to an internationalenvironment
Project Manager,The incumbent will be responsible for IN VAS andMessaging products platforms and services
Sales Manager,The incumbent will build trustful relations withcustomers by providing them assistance and support as well as meet orexceed assigned sales targets by appropriately representing companysservices
Project Manager,The incumbent will be responsible for the management offull logistic chain of operations
Sales Manager,The responsibilities of a Marketing Manager include butare not restricted to the following develop establish and maintainmarketing strategies to meet organizational objectives The incumbentwill be responsible for the effective management of the marketingadvertising and promotional activities of the organization
Sales Manager,The incumbent will be responsible for the developmentand performance of all sales activities in the assigned market He shewill staff and direct a sales team and provide leadership towards theachievement of maximum profitability and growth in line with companyvision and values The Sales Manager will establish plans and strategiesto expand the customer base in the marketing area
Sales Manager,EV Consulting CJSC is seeking a person who may become agatekeeper of the office who earns thousands of thank you from theteammates each day due to his her responsiveness diligence and spiritof service in helping to sort out numerous administrative research andcommunication issues
Sales Manager,The electrician is in charge of exploitationmaintenance repair and installation of electrical equipment in mobilebase stations BS headquarters HQ and other premises in accordancewith the approved internal and external normative documents
Java Developer,Damaris AM is looking for a qualified IT Technician tosupport Damaris IT Infrastructure
Sales Manager,Orange Armenia is looking for a dynamic andselfmotivated individual with experience and skills in web shopmanagement creating promotional roadmaps for increasing online sales andenlarging the auditorium of visitors by implementing various onlineactivities through social media
Project Manager,Dorozhnik LLC is looking for an experienced andmotivated person to cover the position of Import Export Manager
Sales Manager,VoIPShop Telecommunications Inc is seeking a motivatedand success driven person to work as International Sales Manager
Sales Manager,HayPost CJSC is looking for an intelligent andhardworking person to join companys team for the position ofTerritorial Direction Customer Service and Sales Manager ensuring thebest in class service to companys customers
Sales Manager,The incumbent will provide a comprehensive andprofessional finance management service to the Biska Group LLC includingdaytoday accounting reporting and general supervision of the financerelated matters
Sales Manager,VTB Bank Armenia CJSC is looking for a skilled andmotivated manager to fill in the position of Head of CorporateCollections Division for working with Large and Medium Businessesensuring high standards of operational efficiency
Sales Manager,Natali Pharm is looking for an enthusiastic andselfmotivated person who will combine excellent interpersonal andorganizational skills for the position of Product Specialist for B BraunMedical products
Sales Manager,As a Personal Assistant reporting to an assigned topmanagement team member this is a very varied role for the rightcandidate which requires an independent personable Personal Assistantto hit the ground running The incumbent will be dealing with variouscounterparties from different countries so Russian and English languageskills would be important
Sales Manager,The Mall General Manager will be responsible foroverseeing all aspects of mall management including but not limited toleasing and tenant relations business planning and financial managementfacilities and operational management and control of all maintenanceinspection and safety functions
Project Manager,The primary focus of this role is to lead develop anddirect all aspects of World Visions WV work in Armenia as part of thebroader South Caucasus SubRegional program The role includes ensuringWV Armenia programs directly contribute to the sustainable wellbeing ofchildren and fulfilment of their rights within families and communitiesThe incumbent will represent WV Armenia to all donors project partnersother WV Partnership offices and divisions including local governmentchurch representatives and nongovernmental organizations servingaccording to given Power of Attorney He she will model a high standardof personal Christian leadership provide leadership to WV Armenia staffpromoting fairness and transparency in decision making ensure alignmentwith Microfinance MFI through participation in MFI Board and otherGovernance structures and provide appropriate collegial support to MFIExecutive Director
Project Manager,The National Advisor in External Audit will manage theareas of responsibility in close cooperation with other experts of theprogramme including experts in the regional programme structure inTbilisi As an Expert on External Audit the incumbent will beresponsible for advising on the specified areas of responsibility andimplementation of allotted programme activities for securing goodcommunications with key stakeholder institutions and innovation knowledgemanagement within Armenia and the South Caucasus region
Project Manager,At Netsoft USA the Ruby Software Engineer will be partof a project team and help build applications from the ground up Theincumbent will work for a company where software development is thebusiness rather than where its merely considered a necessary expensethat supports the business
Sales Manager,DTC IIBSYerevan Medical Center is seeking proactiveand result oriented individuals to work as a Manager MedicalRepresentative
Java Developer,MLL Industries LLC is looking for a Field Engineer forits HILTI Division
Sales Manager,The incumbent will provide support to implementation ofmultisectoral activities of the Area Development Program ADP in targetcommunities and undertake sectorialprofessional responsibility foreffective and proper implementation of Detailed Implementation Plan DIPactivities assigned to him her The Transformational DevelopmentFacilitator TDF will work with community members on daily basis forimplementation of activities capacity building in monitoring andidentifying partners networking with other stakeholders and making surecommunities are willing to lead their own development processes
Sales Manager,As an ASPNET MVC developer the incumbent will helpbuild the companys nextgeneration web services where millions of usersconnect on a daily basis to learn contribute and interact The companyutilizes NET MVC  AJAX development environment The holder of theposition will work in the areas of collecting specificationsprototyping application development and production support
